{
  "$schema": "http://json-schema.org/draft-07/schema#",
  "type": [
    "object",
    "null"
  ],
  "properties": {
    "headerId": {
      "type": "integer"
    },
    "localizationParameters": {
      "type": "object"
    },
    "protocolLimits": {
      "type": "object"
    },
    "protocolFeatures": {
      "type": "object",
      "properties": {
        "moduleParameters": {
          "type": "object",
          "properties": {
            "clearModuleOnPick": {
              "type": "boolean"
            }
          },
          "required": [
            "clearModuleOnPick"
          ]
        },
        "moduleActions": {
          "type": "array",
          "items": {
            "type": "object",
            "properties": {
              "actionParameters": {
                "type": "array",
                "items": {
                  "type": "object",
                  "properties": {
                    "parameterDescription": {
                      "type": "string"
                    },
                    "parameterName": {
                      "type": "string"
                    },
                    "parameterType": {
                      "type": "string"
                    },
                    "isOptional": {
                      "type": "boolean"
                    }
                  },
                  "required": [
                    "parameterDescription",
                    "parameterName",
                    "parameterType"
                  ]
                }
              },
              "actionType": {
                "type": "string"
              },
              "actionScopes": {
                "type": "array",
                "items": {
                  "type": "string"
                }
              }
            },
            "required": [
              "actionType"
            ]
          }
        }
      },
      "required": [
        "moduleActions"
      ]
    },
    "version": {
      "type": "string"
    },
    "serialNumber": {
      "type": "string"
    },
    "timestamp": {
      "type": "string"
    },
    "physicalParameters": {
      "type": "object"
    },
    "loadSpecification": {
      "type": "object",
      "properties": {
        "loadSets": {
          "type": "array",
          "items": {
            "type": "object",
            "properties": {
              "loadType": {
                "type": "string"
              },
              "setName": {
                "type": "string"
              }
            },
            "required": [
              "loadType",
              "setName"
            ]
          }
        }
      },
      "required": [
        "loadSets"
      ]
    },
    "typeSpecification": {
      "type": "object",
      "properties": {
        "moduleClass": {
          "type": "string"
        },
        "seriesName": {
          "type": "string"
        }
      },
      "required": [
        "moduleClass",
        "seriesName"
      ]
    },
    "manufacturer": {
      "type": "string"
    }
  },
  "required": [
    "headerId",
    "loadSpecification",
    "localizationParameters",
    "manufacturer",
    "physicalParameters",
    "protocolFeatures",
    "protocolLimits",
    "serialNumber",
    "timestamp",
    "typeSpecification",
    "version"
  ],
  "title": "Module_V1_Ff_Nodered_Serial_Factsheet Schema",
  "description": "Granular schema for module_v1_ff_NodeRed_serial_factsheet topics from 14 examples",
  "category": "module",
  "additionalProperties": true
}